rule_name,description,affected_count,classification,explanation,recommendation
source_file_must_exist,Blocked because source file path no longer exists on disk,10,DATA_ISSUE,"Phase 6 safe_apply renamed .temp files but Phase 7 still references old paths. The data references are stale, not the rule.",Update duplicate_state paths after Phase 6 renames so subsequent phases see current paths
complex_duplicate_requires_review,COMPLEX_DUPLICATE groups held for explicit review,47,KEEP_RULE,These groups have low selection confidence or ambiguous duplicates. Holding them is correct safety behavior.,Keep rule. Provide manual review interface for future resolution.
needs_review_stays_in_queue,Phase 6 NEEDS_REVIEW items kept in review queue,48,KEEP_RULE,These are low-confidence duplicate group members. Keeping in review is correct.,Keep rule. These need duplicate group resolution first.
illegal_chars_with_low_conf_blocked,Files with illegal chars + conf<=0.3 kept in review,29,RELAXABLE_RULE,Phase 7 only approves illegal_chars files with conf>=0.6. Many of these (26) have conf=0.3 from fallback parse which still produced reasonable Artist - Title format. The chars are mechanically fixable.,Relax threshold to conf>=0.3 for illegal_chars if sanitize_filename produces valid output
zero_confidence_blocked,Files with confidence=0.0 kept in review,17,KEEP_RULE,Zero confidence means no reliable artist-title parse. These genuinely need manual review.,Keep rule. Consider batch manual review workflow.
no_change_zero_conf_blocked,Files with no collision issues but zero parse confidence,12,KEEP_RULE,"No collision, but the filename couldn't be parsed. Promotion would use raw filename.",Keep rule. These need parse improvements or manual naming.
orphan_duplicate_risk_blocked,Files with duplicate_risk but not grouped in Phase 6,9,EDGE_CASE,These have duplicate_risk flags from Phase 3 batch intake but weren't captured in Phase 6 grouping. May be false positives or edge cases.,"Re-evaluate these against Phase 6 groups. If no actual duplicate exists, clear the duplicate_risk and allow promotion."
fallback_parse_blocked,Files parsed only by fallback method,2,KEEP_RULE,Fallback parse is unreliable. Correct to hold these.,Keep rule. Consider improving parser for these patterns.
